{
    "$schema": "edges.schema.json",
    "2fa": true,
    "type": "t",
    "!!!": 3,
    "maybe": "m",
    "level": "high",
    "num": 2,
    "nothing": null,
    "inferred": { "a": 1 },
    "ints": [1, 1],
    "floats": [1.5],
    "flags": [true],
    "units": [null],
    "words": ["w"],
    "none": [],
    "empty": {},
    "first": { "x": "x" },
    "second": {},
    "closed": { "a": "a" },
    "control": "a\u0001b",
    "shape": { "kind": "first", "n": 7 },
    "shapes": [{ "kind": "bare" }]
}
